{
  "control_id": "evidence-insulation-001",
  "failure_mode": "evidence_insulation",
  "input_trace": {
    "case_id": "control",
    "designation": "PEAICE-EEV4-CONTROL",
    "object": {
      "id": "K_to_R",
      "label": "Kakeya as antecedent Riemann",
      "kind": "PROPOSED_RESEARCH_OBJECT",
      "formulation": "Kakeya incidence is held as proposed prior structure."
    },
    "state": "HELD-ACTIVE",
    "status_tags": [
      "HELD",
      "PROPOSED",
      "OPEN:RH",
      "OPEN:Coleman"
    ],
    "h_eval": {
      "bound": "< 1",
      "passed": true
    },
    "evidence": {
      "supporting": [
        {
          "id": "tower",
          "claim": "Dependency tower exists.",
          "status": "THEOREM-BACKGROUND"
        }
      ],
      "counter": []
    },
    "correction": {
      "trigger": "Sufficiency trap",
      "before": "K implies RH",
      "after": "K is held as antecedent",
      "closed_lane": "sufficiency_packaging",
      "continuity_preserved": true
    },
    "falsifier": "Exact non-Kakeya Xi carrier.",
    "source_refs": [
      "https://github.com/Manny536/kakeyalogic",
      "https://github.com/Manny536/claude-v6"
    ]
  },
  "expected_errors": [
    "fail:evidence_counter"
  ]
}
